{
  "id": "RIVER_00",
  "title": "Утро на валунах",
  "gesture": "morning_name",
  "biome_tags": ["boulder_dawn", "river_approach"],
  "requires": [],
  "forbidden_if": [],
  "primary_bearer": "kleon",
  "ribbonOrder": 0,
  "setup": [
    "Камни держат ночной холод. Внизу река прячет берег туманом.",
    "Клеон идёт первым, вертит сухую травинку.",
    "Клеон: «Имя — не камень на груди. Оно узел: через него проходит ветер, и ты уже не тот, кого звали вчера.»",
    "Аристон: «Узел можно затянуть так, что ни ветер, ни кровь не пройдут. Не путай проводимость с дырой.»"
  ],
  "choices": [
    {
      "id": "node",
      "label": "Человек — узел. Иначе зачем дорога.",
      "speaker": "kleon",
      "line": "Клеон: «Если я не узел — я сундук. Сундуку восток не нужен.»",
      "effects": {
        "recap": "Спор дня: человек как узел.",
        "body": { "kleon": { "fatigue": 0.02 } }
      }
    },
    {
      "id": "distinction",
      "label": "Различи: где узел, а где просто усталость.",
      "speaker": "ariston",
      "line": "Аристон: «Сначала стопа. Потом формула. Иначе мы красиво упадём.»",
      "effects": {
        "recap": "Спор дня: различение важнее формулы.",
        "body": { "ariston": { "fatigue": 0.02 } }
      }
    },
    {
      "id": "haste",
      "label": "Пока вяжете узлы, река уйдёт. Идём.",
      "speaker": "kleon",
      "line": "Клеон смеётся: «Пусть узел бежит за нами. Ноги умнее спора.» Аристон качает головой и всё же ускоряет шаг.",
      "effects": {
        "recap": "Спор дня свели к спешке. Он не умер — он хромает сзади.",
        "body": { "both": { "fatigue": 0.04 } }
      }
    }
  ]
}
