{
  "id": "RIVER_04",
  "title": "Камень и попадание",
  "gesture": "throw",
  "biome_tags": ["boulder_dawn", "river_approach"],
  "requires": [],
  "forbidden_if": [],
  "primary_bearer": "kleon",
  "ribbonOrder": 10,
  "setup": [
    "Между валунами щель. Клеон уже держит плоский камень — тонкий, как черепок.",
    "Он бросает, не целясь глазами. Камень встаёт в щель, как если бы щель ждала.",
    "Клеон тихо: «Я знал.»"
  ],
  "choices": [
    {
      "id": "let_him_throw",
      "label": "Пусть бросит ещё",
      "speaker": "kleon",
      "line": "Второй камень тоже входит. Клеон смеётся слишком светло.",
      "effects": {
        "flags": { "pride_of_throw": true },
        "recap": "Гордыня броска греет ладонь. Позже она станет лишним движением.",
        "outcome": "pride"
      }
    },
    {
      "id": "ask_what_he_felt",
      "label": "Спросить, что он чувствовал",
      "speaker": "ariston",
      "line": "Клеон ищет слово и не находит. «Не я. И не камень. Середина.»",
      "effects": {
        "recap": "Спросили о броске. Странность осталась живой, без имени.",
        "outcome": "asked"
      }
    },
    {
      "id": "mock_gently",
      "label": "Тихо поддеть",
      "speaker": "ariston",
      "line": "Аристон: «Щель была шире твоего учения.» Клеон улыбается криво. Слух задет.",
      "effects": {
        "recap": "Насмешка спасла от храма пафоса и чуть ранила слух.",
        "outcome": "mocked"
      }
    },
    {
      "id": "name_it_god",
      "label": "Назвать это богом",
      "speaker": "kleon",
      "line": "Клеон: «Кто-то бросил через меня.» Весь день он будет чуть самодовольнее стопы.",
      "effects": {
        "flags": { "pride_of_throw": true },
        "recap": "Назвали бросок богом. Младший носит это как венок из пыли.",
        "outcome": "god"
      }
    },
    {
      "id": "name_it_craft",
      "label": "Назвать это ремеслом",
      "speaker": "ariston",
      "line": "Аристон: «Кисть, локоть, повтор. Не чудо.» Странность чуть умирает.",
      "effects": {
        "recap": "Свели попадание к ремеслу. Точно — и беднее.",
        "outcome": "craft"
      }
    },
    {
      "id": "stay_silent",
      "label": "Молчать",
      "speaker": "ariston",
      "line": "Аристон не называет. Клеон кладёт черепок обратно в щель, как чужой.",
      "effects": {
        "recap": "Молчание старшего оставило странность живой.",
        "outcome": "silent"
      }
    }
  ]
}
